{
  "id": "01ARZ3NDEKTSV4RRFFQ69G5FAV",
  "rev": 1,
  "created_at": "2026-10-16T12:00:00Z",
  "updated_at": "2026-10-16T12:00:00Z",
  "request_id": "saga-request-1",
  "request_rev": 1,
  "principal": "operator:fixture",
  "proposal_digest": "aaaaaaaaaaaaaaaaaaaaaaaaaaaaaaaaaaaaaaaaaaaaaaaaaaaaaaaaaaaaaaaa",
  "source_event": "fixture:1",
  "channel": "terminal",
  "received_at": "2026-10-16T12:00:00Z",
  "expires_at": "2026-10-16T12:00:00Z",
  "state": "granted"
}
